type,itemnum,sentence,condition,the,adj,and,
practice,10001,Innocent smiles and costly dinners disguised their unhappiness.,practice,practice,practice,practice,
practice,10002,Scissors cut through the credit card.,practice,practice,practice,practice,
practice,10003,Amidst the vibrant city lights the people lived as if there was no tomorrow.,practice,practice,practice,practice,
practice,10004,Within the serene garden oasis lied a witch.,practice,practice,practice,practice,
practice,10005,Professors have been known to lie to their students; Joseph has pushed that too far.,practice,practice,practice,practice,
practice,10006,Xinchi found a turkey in our backyard; turkeys are extremely noisy.,practice,practice,practice,practice,
